{"apiVersion":"bugate.io/v2","delivery_criteria":["business_understanding","test_design","implementation","execution","report","knowledge"],"goal":"Verify bounded integers","id":"same-task","kind":"TestTask","project_root":"/private/var/folders/f2/78sk3lk55k32h_0mjpjbpd6h0000gn/T/bugate-installed-dsh-LPCM8E/generated-project","requirements":["R1"],"risks":["K1"],"source_ids":["SRC1"],"task_root":"/private/var/folders/f2/78sk3lk55k32h_0mjpjbpd6h0000gn/T/bugate-installed-dsh-LPCM8E/generated-project/test-task/same-task","unknowns":[],"workspace_id":"sha256:cdfdb32e721f3faffef5ba403eebe28f0a19a1fb81d2b00dd530e8962c65c9e2"}
